{"schema":"runtime-bank-sel@1","file_id":"s-achievement_biology","scope":"prep:achievement/biology","columns":["key","lesson","band","component","type","stimulus","premium","revision","chunk","objective"],"rows":[["ab-001","prep:achievement/biology/cells",1,null,"mcq",null,false,1,"achievement_biology-01",null],["ab-002","prep:achievement/biology/cells",1,null,"mcq",null,false,1,"achievement_biology-01",null],["ab-003","prep:achievement/biology/cells",2,null,"mcq",null,false,1,"achievement_biology-01",null],["ab-004","prep:achievement/biology/cells",2,null,"mcq",null,false,1,"achievement_biology-01",null],["ab-005","prep:achievement/biology/cells",3,null,"mcq",null,false,1,"achievement_biology-01",null],["ab-006","prep:achievement/biology/genetics",1,null,"mcq",null,false,1,"achievement_biology-01",null],["ab-007","prep:achievement/biology/genetics",2,null,"mcq",null,false,1,"achievement_biology-01",null],["ab-008","prep:achievement/biology/genetics",2,null,"mcq",null,false,1,"achievement_biology-01",null],["ab-009","prep:achievement/biology/genetics",3,null,"mcq",null,false,1,"achievement_biology-01",null],["ab-010","prep:achievement/biology/genetics",3,null,"mcq",null,false,1,"achievement_biology-01",null],["ab-011","prep:achievement/biology/human-body",1,null,"mcq",null,false,1,"achievement_biology-01",null],["ab-012","prep:achievement/biology/human-body",1,null,"mcq",null,false,1,"achievement_biology-01",null],["ab-013","prep:achievement/biology/human-body",2,null,"mcq",null,false,1,"achievement_biology-01",null],["ab-014","prep:achievement/biology/human-body",2,null,"mcq",null,false,1,"achievement_biology-01",null],["ab-015","prep:achievement/biology/human-body",3,null,"mcq",null,false,1,"achievement_biology-01",null],["ab-016","prep:achievement/biology/plants",1,null,"mcq",null,false,1,"achievement_biology-01",null],["ab-017","prep:achievement/biology/plants",1,null,"mcq",null,false,1,"achievement_biology-01",null],["ab-018","prep:achievement/biology/plants",2,null,"mcq",null,false,1,"achievement_biology-01",null],["ab-019","prep:achievement/biology/plants",2,null,"mcq",null,false,1,"achievement_biology-01",null],["ab-020","prep:achievement/biology/plants",3,null,"mcq",null,false,1,"achievement_biology-01",null],["ab-021","prep:achievement/biology/ecology",1,null,"mcq",null,false,1,"achievement_biology-01",null],["ab-022","prep:achievement/biology/ecology",1,null,"mcq",null,false,1,"achievement_biology-01",null],["ab-023","prep:achievement/biology/ecology",2,null,"mcq",null,false,1,"achievement_biology-01",null],["ab-024","prep:achievement/biology/ecology",2,null,"mcq",null,false,1,"achievement_biology-01",null],["ab-025","prep:achievement/biology/ecology",3,null,"mcq",null,false,1,"achievement_biology-01",null],["ab-026","prep:achievement/biology/classification-evolution",1,null,"mcq",null,false,1,"achievement_biology-01",null],["ab-028","prep:achievement/biology/classification-evolution",2,null,"mcq",null,false,1,"achievement_biology-01",null],["ab-029","prep:achievement/biology/classification-evolution",2,null,"mcq",null,false,1,"achievement_biology-01",null],["ab-030","prep:achievement/biology/classification-evolution",3,null,"mcq",null,false,1,"achievement_biology-01",null],["ab-031","prep:achievement/biology/microbiology",1,null,"mcq",null,false,1,"achievement_biology-01",null],["ab-032","prep:achievement/biology/microbiology",1,null,"mcq",null,false,1,"achievement_biology-01",null],["ab-033","prep:achievement/biology/microbiology",2,null,"mcq",null,false,1,"achievement_biology-01",null],["ab-034","prep:achievement/biology/microbiology",2,null,"mcq",null,false,1,"achievement_biology-01",null],["ab-035","prep:achievement/biology/microbiology",2,null,"mcq",null,false,1,"achievement_biology-01",null],["ab-036","prep:achievement/biology/biochemistry",1,null,"mcq",null,false,1,"achievement_biology-01",null],["ab-037","prep:achievement/biology/biochemistry",2,null,"mcq",null,false,1,"achievement_biology-01",null],["ab-038","prep:achievement/biology/biochemistry",2,null,"mcq",null,false,1,"achievement_biology-01",null],["ab-039","prep:achievement/biology/biochemistry",2,null,"mcq",null,false,1,"achievement_biology-01",null],["ab-040","prep:achievement/biology/biochemistry",3,null,"mcq",null,false,1,"achievement_biology-01",null]]}
