{"schema":"runtime-bank-sel@1","file_id":"s-achievement_chemistry","scope":"prep:achievement/chemistry","columns":["key","lesson","band","component","type","stimulus","premium","revision","chunk","objective"],"rows":[["ac-001","prep:achievement/chemistry/atomic-structure",1,null,"mcq",null,false,1,"achievement_chemistry-01",null],["ac-002","prep:achievement/chemistry/atomic-structure",1,null,"mcq",null,false,1,"achievement_chemistry-01",null],["ac-003","prep:achievement/chemistry/atomic-structure",2,null,"mcq",null,false,1,"achievement_chemistry-01",null],["ac-004","prep:achievement/chemistry/atomic-structure",2,null,"mcq",null,false,1,"achievement_chemistry-01",null],["ac-005","prep:achievement/chemistry/atomic-structure",3,null,"mcq",null,false,1,"achievement_chemistry-01",null],["ac-006","prep:achievement/chemistry/periodic-table",1,null,"mcq",null,false,1,"achievement_chemistry-01",null],["ac-007","prep:achievement/chemistry/periodic-table",1,null,"mcq",null,false,1,"achievement_chemistry-01",null],["ac-008","prep:achievement/chemistry/periodic-table",2,null,"mcq",null,false,1,"achievement_chemistry-01",null],["ac-009","prep:achievement/chemistry/periodic-table",2,null,"mcq",null,false,1,"achievement_chemistry-01",null],["ac-010","prep:achievement/chemistry/periodic-table",3,null,"mcq",null,false,1,"achievement_chemistry-01",null],["ac-011","prep:achievement/chemistry/bonding",1,null,"mcq",null,false,1,"achievement_chemistry-01",null],["ac-012","prep:achievement/chemistry/bonding",1,null,"mcq",null,false,1,"achievement_chemistry-01",null],["ac-013","prep:achievement/chemistry/bonding",2,null,"mcq",null,false,1,"achievement_chemistry-01",null],["ac-014","prep:achievement/chemistry/bonding",2,null,"mcq",null,false,1,"achievement_chemistry-01",null],["ac-015","prep:achievement/chemistry/bonding",3,null,"mcq",null,false,1,"achievement_chemistry-01",null],["ac-016","prep:achievement/chemistry/stoichiometry",1,null,"mcq",null,false,1,"achievement_chemistry-01",null],["ac-017","prep:achievement/chemistry/stoichiometry",2,null,"mcq",null,false,1,"achievement_chemistry-01",null],["ac-018","prep:achievement/chemistry/stoichiometry",2,null,"mcq",null,false,1,"achievement_chemistry-01",null],["ac-019","prep:achievement/chemistry/stoichiometry",2,null,"mcq",null,false,1,"achievement_chemistry-01",null],["ac-021","prep:achievement/chemistry/solutions",1,null,"mcq",null,false,1,"achievement_chemistry-01",null],["ac-022","prep:achievement/chemistry/solutions",2,null,"mcq",null,false,1,"achievement_chemistry-01",null],["ac-023","prep:achievement/chemistry/solutions",2,null,"mcq",null,false,1,"achievement_chemistry-01",null],["ac-024","prep:achievement/chemistry/solutions",2,null,"mcq",null,false,1,"achievement_chemistry-01",null],["ac-025","prep:achievement/chemistry/solutions",3,null,"mcq",null,false,1,"achievement_chemistry-01",null],["ac-026","prep:achievement/chemistry/acids-bases",1,null,"mcq",null,false,1,"achievement_chemistry-01",null],["ac-027","prep:achievement/chemistry/acids-bases",1,null,"mcq",null,false,1,"achievement_chemistry-01",null],["ac-028","prep:achievement/chemistry/acids-bases",2,null,"mcq",null,false,1,"achievement_chemistry-01",null],["ac-029","prep:achievement/chemistry/acids-bases",2,null,"mcq",null,false,1,"achievement_chemistry-01",null],["ac-030","prep:achievement/chemistry/acids-bases",3,null,"mcq",null,false,1,"achievement_chemistry-01",null],["ac-031","prep:achievement/chemistry/thermochemistry",1,null,"mcq",null,false,1,"achievement_chemistry-01",null],["ac-032","prep:achievement/chemistry/thermochemistry",1,null,"mcq",null,false,1,"achievement_chemistry-01",null],["ac-033","prep:achievement/chemistry/thermochemistry",2,null,"mcq",null,false,1,"achievement_chemistry-01",null],["ac-034","prep:achievement/chemistry/thermochemistry",2,null,"mcq",null,false,1,"achievement_chemistry-01",null],["ac-035","prep:achievement/chemistry/thermochemistry",3,null,"mcq",null,false,1,"achievement_chemistry-01",null],["ac-036","prep:achievement/chemistry/organic",1,null,"mcq",null,false,1,"achievement_chemistry-01",null],["ac-037","prep:achievement/chemistry/organic",1,null,"mcq",null,false,1,"achievement_chemistry-01",null],["ac-038","prep:achievement/chemistry/organic",2,null,"mcq",null,false,1,"achievement_chemistry-01",null],["ac-039","prep:achievement/chemistry/organic",2,null,"mcq",null,false,1,"achievement_chemistry-01",null],["ac-040","prep:achievement/chemistry/organic",3,null,"mcq",null,false,1,"achievement_chemistry-01",null]]}
