{"schema":"runtime-bank-sel@1","file_id":"s-middle_grade-1_science","scope":"middle/grade-1/science","columns":["key","lesson","band","component","type","stimulus","premium","revision","chunk","objective"],"rows":[["q-m1-science-3b96fc064f","middle/grade-1/science/xa3e7e839",1,null,"mcq",null,false,1,"middle_grade-1_science-01",null],["q-m1-science-41242b9fae","middle/grade-1/science/xe389fa43",2,null,"short_answer",null,false,1,"middle_grade-1_science-01",null],["q-m1-science-5b840157e7","middle/grade-1/science/xe389fa43",3,null,"mcq",null,false,1,"middle_grade-1_science-01",null],["q-m1-science-ad328846aa","middle/grade-1/science/xc241a07b",2,null,"true_false",null,false,1,"middle_grade-1_science-01",null],["q-m1-science-e8bc163c82","middle/grade-1/science/xc241a07b",1,null,"mcq",null,false,1,"middle_grade-1_science-01",null]]}
