{"schema":"runtime-bank-sel@1","file_id":"s-achievement_math","scope":"prep:achievement/math","columns":["key","lesson","band","component","type","stimulus","premium","revision","chunk","objective"],"rows":[["am-001","prep:achievement/math/algebra",1,null,"mcq",null,false,1,"achievement_math-01",null],["am-002","prep:achievement/math/algebra",1,null,"mcq",null,false,1,"achievement_math-01",null],["am-003","prep:achievement/math/algebra",2,null,"mcq",null,false,1,"achievement_math-01",null],["am-004","prep:achievement/math/algebra",2,null,"mcq",null,false,1,"achievement_math-01",null],["am-005","prep:achievement/math/algebra",3,null,"mcq",null,false,1,"achievement_math-01",null],["am-006","prep:achievement/math/functions",1,null,"mcq",null,false,1,"achievement_math-01",null],["am-007","prep:achievement/math/functions",1,null,"mcq",null,false,1,"achievement_math-01",null],["am-008","prep:achievement/math/functions",2,null,"mcq",null,false,1,"achievement_math-01",null],["am-009","prep:achievement/math/functions",2,null,"mcq",null,false,1,"achievement_math-01",null],["am-010","prep:achievement/math/functions",2,null,"mcq",null,false,1,"achievement_math-01",null],["am-011","prep:achievement/math/functions",3,null,"mcq",null,false,1,"achievement_math-01",null],["am-012","prep:achievement/math/trigonometry",1,null,"mcq",null,false,1,"achievement_math-01",null],["am-013","prep:achievement/math/trigonometry",1,null,"mcq",null,false,1,"achievement_math-01",null],["am-014","prep:achievement/math/trigonometry",2,null,"mcq",null,false,1,"achievement_math-01",null],["am-016","prep:achievement/math/trigonometry",3,null,"mcq",null,false,1,"achievement_math-01",null],["am-017","prep:achievement/math/geometry",1,null,"mcq",null,false,1,"achievement_math-01",null],["am-018","prep:achievement/math/geometry",1,null,"mcq",null,false,1,"achievement_math-01",null],["am-019","prep:achievement/math/geometry",2,null,"mcq",null,false,1,"achievement_math-01",null],["am-020","prep:achievement/math/geometry",2,null,"mcq",null,false,1,"achievement_math-01",null],["am-021","prep:achievement/math/geometry",3,null,"mcq",null,false,1,"achievement_math-01",null],["am-022","prep:achievement/math/calculus",1,null,"mcq",null,false,1,"achievement_math-01",null],["am-023","prep:achievement/math/calculus",1,null,"mcq",null,false,1,"achievement_math-01",null],["am-024","prep:achievement/math/calculus",2,null,"mcq",null,false,1,"achievement_math-01",null],["am-025","prep:achievement/math/calculus",2,null,"mcq",null,false,1,"achievement_math-01",null],["am-026","prep:achievement/math/calculus",2,null,"mcq",null,false,1,"achievement_math-01",null],["am-027","prep:achievement/math/calculus",3,null,"mcq",null,false,1,"achievement_math-01",null],["am-028","prep:achievement/math/statistics-probability",1,null,"mcq",null,false,1,"achievement_math-01",null],["am-029","prep:achievement/math/statistics-probability",2,null,"mcq",null,false,1,"achievement_math-01",null],["am-030","prep:achievement/math/statistics-probability",2,null,"mcq",null,false,1,"achievement_math-01",null],["am-031","prep:achievement/math/statistics-probability",2,null,"mcq",null,false,1,"achievement_math-01",null],["am-032","prep:achievement/math/statistics-probability",3,null,"mcq",null,false,1,"achievement_math-01",null],["am-033","prep:achievement/math/sequences",1,null,"mcq",null,false,1,"achievement_math-01",null],["am-034","prep:achievement/math/sequences",1,null,"mcq",null,false,1,"achievement_math-01",null],["am-035","prep:achievement/math/sequences",2,null,"mcq",null,false,1,"achievement_math-01",null],["am-036","prep:achievement/math/sequences",3,null,"mcq",null,false,1,"achievement_math-01",null],["am-037","prep:achievement/math/matrices",1,null,"mcq",null,false,1,"achievement_math-01",null],["am-038","prep:achievement/math/matrices",2,null,"mcq",null,false,1,"achievement_math-01",null],["am-039","prep:achievement/math/matrices",2,null,"mcq",null,false,1,"achievement_math-01",null],["am-040","prep:achievement/math/matrices",3,null,"mcq",null,false,1,"achievement_math-01",null]]}
