{"schema":"runtime-bank-sel@1","file_id":"s-aptitude_verbal","scope":"prep:aptitude/verbal","columns":["key","lesson","band","component","type","stimulus","premium","revision","chunk","objective"],"rows":[["av-001","prep:aptitude/verbal/analogy",1,null,"mcq",null,false,1,"aptitude_verbal-01",null],["av-002","prep:aptitude/verbal/analogy",1,null,"mcq",null,false,1,"aptitude_verbal-01",null],["av-003","prep:aptitude/verbal/analogy",1,null,"mcq",null,false,1,"aptitude_verbal-01",null],["av-004","prep:aptitude/verbal/analogy",1,null,"mcq",null,false,1,"aptitude_verbal-01",null],["av-005","prep:aptitude/verbal/analogy",1,null,"mcq",null,false,1,"aptitude_verbal-01",null],["av-006","prep:aptitude/verbal/analogy",2,null,"mcq",null,false,1,"aptitude_verbal-01",null],["av-007","prep:aptitude/verbal/analogy",2,null,"mcq",null,false,1,"aptitude_verbal-01",null],["av-008","prep:aptitude/verbal/analogy",2,null,"mcq",null,false,1,"aptitude_verbal-01",null],["av-009","prep:aptitude/verbal/analogy",2,null,"mcq",null,false,1,"aptitude_verbal-01",null],["av-010","prep:aptitude/verbal/analogy",2,null,"mcq",null,false,1,"aptitude_verbal-01",null],["av-011","prep:aptitude/verbal/analogy",2,null,"mcq",null,false,1,"aptitude_verbal-01",null],["av-012","prep:aptitude/verbal/analogy",3,null,"mcq",null,false,1,"aptitude_verbal-01",null],["av-013","prep:aptitude/verbal/analogy",3,null,"mcq",null,false,1,"aptitude_verbal-01",null],["av-014","prep:aptitude/verbal/analogy",3,null,"mcq",null,false,1,"aptitude_verbal-01",null],["av-015","prep:aptitude/verbal/sentence-completion",2,null,"mcq",null,false,1,"aptitude_verbal-01",null],["av-016","prep:aptitude/verbal/sentence-completion",1,null,"mcq",null,false,1,"aptitude_verbal-01",null],["av-017","prep:aptitude/verbal/sentence-completion",1,null,"mcq",null,false,1,"aptitude_verbal-01",null],["av-018","prep:aptitude/verbal/sentence-completion",1,null,"mcq",null,false,1,"aptitude_verbal-01",null],["av-019","prep:aptitude/verbal/sentence-completion",1,null,"mcq",null,false,1,"aptitude_verbal-01",null],["av-020","prep:aptitude/verbal/sentence-completion",2,null,"mcq",null,false,1,"aptitude_verbal-01",null],["av-021","prep:aptitude/verbal/sentence-completion",2,null,"mcq",null,false,1,"aptitude_verbal-01",null],["av-022","prep:aptitude/verbal/sentence-completion",2,null,"mcq",null,false,1,"aptitude_verbal-01",null],["av-023","prep:aptitude/verbal/sentence-completion",2,null,"mcq",null,false,1,"aptitude_verbal-01",null],["av-024","prep:aptitude/verbal/sentence-completion",2,null,"mcq",null,false,1,"aptitude_verbal-01",null],["av-025","prep:aptitude/verbal/sentence-completion",3,null,"mcq",null,false,1,"aptitude_verbal-01",null],["av-026","prep:aptitude/verbal/sentence-completion",3,null,"mcq",null,false,1,"aptitude_verbal-01",null],["av-027","prep:aptitude/verbal/contextual-error",1,null,"mcq",null,false,1,"aptitude_verbal-01",null],["av-028","prep:aptitude/verbal/contextual-error",1,null,"mcq",null,false,1,"aptitude_verbal-01",null],["av-029","prep:aptitude/verbal/contextual-error",1,null,"mcq",null,false,1,"aptitude_verbal-01",null],["av-030","prep:aptitude/verbal/contextual-error",1,null,"mcq",null,false,1,"aptitude_verbal-01",null],["av-031","prep:aptitude/verbal/contextual-error",2,null,"mcq",null,false,1,"aptitude_verbal-01",null],["av-032","prep:aptitude/verbal/contextual-error",2,null,"mcq",null,false,1,"aptitude_verbal-01",null],["av-033","prep:aptitude/verbal/contextual-error",2,null,"mcq",null,false,1,"aptitude_verbal-01",null],["av-034","prep:aptitude/verbal/contextual-error",2,null,"mcq",null,false,1,"aptitude_verbal-01",null],["av-035","prep:aptitude/verbal/contextual-error",2,null,"mcq",null,false,1,"aptitude_verbal-01",null],["av-036","prep:aptitude/verbal/contextual-error",3,null,"mcq",null,false,1,"aptitude_verbal-01",null],["av-037","prep:aptitude/verbal/contextual-error",3,null,"mcq",null,false,1,"aptitude_verbal-01",null],["av-038","prep:aptitude/verbal/odd-word-out",1,null,"mcq",null,false,1,"aptitude_verbal-01",null],["av-039","prep:aptitude/verbal/odd-word-out",1,null,"mcq",null,false,1,"aptitude_verbal-01",null],["av-040","prep:aptitude/verbal/odd-word-out",1,null,"mcq",null,false,1,"aptitude_verbal-01",null],["av-041","prep:aptitude/verbal/odd-word-out",2,null,"mcq",null,false,1,"aptitude_verbal-01",null],["av-042","prep:aptitude/verbal/odd-word-out",2,null,"mcq",null,false,1,"aptitude_verbal-01",null],["av-043","prep:aptitude/verbal/odd-word-out",2,null,"mcq",null,false,1,"aptitude_verbal-01",null],["av-044","prep:aptitude/verbal/odd-word-out",2,null,"mcq",null,false,1,"aptitude_verbal-01",null],["av-045","prep:aptitude/verbal/odd-word-out",3,null,"mcq",null,false,1,"aptitude_verbal-01",null],["av-046","prep:aptitude/verbal/reading-comprehension",1,null,"mcq","st-bbbf79cc4b",false,1,"aptitude_verbal-01",null],["av-047","prep:aptitude/verbal/reading-comprehension",2,null,"mcq","st-bbbf79cc4b",false,1,"aptitude_verbal-01",null],["av-048","prep:aptitude/verbal/reading-comprehension",2,null,"mcq","st-bbbf79cc4b",false,1,"aptitude_verbal-01",null],["av-049","prep:aptitude/verbal/reading-comprehension",1,null,"mcq","st-90a33ff47d",false,1,"aptitude_verbal-01",null],["av-050","prep:aptitude/verbal/reading-comprehension",2,null,"mcq","st-90a33ff47d",false,1,"aptitude_verbal-01",null],["av-051","prep:aptitude/verbal/reading-comprehension",3,null,"mcq","st-90a33ff47d",false,1,"aptitude_verbal-01",null],["av-052","prep:aptitude/verbal/reading-comprehension",1,null,"mcq","st-72554170c9",false,1,"aptitude_verbal-01",null],["av-053","prep:aptitude/verbal/reading-comprehension",2,null,"mcq","st-72554170c9",false,1,"aptitude_verbal-01",null],["av-054","prep:aptitude/verbal/reading-comprehension",3,null,"mcq","st-72554170c9",false,1,"aptitude_verbal-01",null],["av-055","prep:aptitude/verbal/reading-comprehension",1,null,"mcq","st-350b7b7e9b",false,1,"aptitude_verbal-01",null],["av-056","prep:aptitude/verbal/reading-comprehension",2,null,"mcq","st-350b7b7e9b",false,1,"aptitude_verbal-01",null],["av-057","prep:aptitude/verbal/reading-comprehension",3,null,"mcq","st-350b7b7e9b",false,1,"aptitude_verbal-01",null],["av-058","prep:aptitude/verbal/reading-comprehension",1,null,"mcq","st-06447ebad2",false,1,"aptitude_verbal-01",null],["av-059","prep:aptitude/verbal/reading-comprehension",2,null,"mcq","st-06447ebad2",false,1,"aptitude_verbal-01",null],["av-060","prep:aptitude/verbal/reading-comprehension",3,null,"mcq","st-06447ebad2",false,1,"aptitude_verbal-01",null]]}
