{"schema":"runtime-bank-sel@1","file_id":"s-achievement_physics","scope":"prep:achievement/physics","columns":["key","lesson","band","component","type","stimulus","premium","revision","chunk","objective"],"rows":[["ap-001","prep:achievement/physics/kinematics",1,null,"mcq",null,false,1,"achievement_physics-01",null],["ap-002","prep:achievement/physics/kinematics",1,null,"mcq",null,false,1,"achievement_physics-01",null],["ap-003","prep:achievement/physics/kinematics",2,null,"mcq",null,false,1,"achievement_physics-01",null],["ap-004","prep:achievement/physics/kinematics",2,null,"mcq",null,false,1,"achievement_physics-01",null],["ap-005","prep:achievement/physics/kinematics",3,null,"mcq",null,false,1,"achievement_physics-01",null],["ap-006","prep:achievement/physics/forces-motion",1,null,"mcq",null,false,1,"achievement_physics-01",null],["ap-007","prep:achievement/physics/forces-motion",1,null,"mcq",null,false,1,"achievement_physics-01",null],["ap-008","prep:achievement/physics/forces-motion",2,null,"mcq",null,false,1,"achievement_physics-01",null],["ap-009","prep:achievement/physics/forces-motion",2,null,"mcq",null,false,1,"achievement_physics-01",null],["ap-010","prep:achievement/physics/forces-motion",3,null,"mcq",null,false,1,"achievement_physics-01",null],["ap-011","prep:achievement/physics/energy-work",1,null,"mcq",null,false,1,"achievement_physics-01",null],["ap-012","prep:achievement/physics/energy-work",2,null,"mcq",null,false,1,"achievement_physics-01",null],["ap-013","prep:achievement/physics/energy-work",2,null,"mcq",null,false,1,"achievement_physics-01",null],["ap-014","prep:achievement/physics/energy-work",1,null,"mcq",null,false,1,"achievement_physics-01",null],["ap-015","prep:achievement/physics/energy-work",3,null,"mcq",null,false,1,"achievement_physics-01",null],["ap-016","prep:achievement/physics/electricity",1,null,"mcq",null,false,1,"achievement_physics-01",null],["ap-017","prep:achievement/physics/electricity",2,null,"mcq",null,false,1,"achievement_physics-01",null],["ap-018","prep:achievement/physics/electricity",2,null,"mcq",null,false,1,"achievement_physics-01",null],["ap-019","prep:achievement/physics/electricity",2,null,"mcq",null,false,1,"achievement_physics-01",null],["ap-020","prep:achievement/physics/electricity",3,null,"mcq",null,false,1,"achievement_physics-01",null],["ap-021","prep:achievement/physics/waves-sound",1,null,"mcq",null,false,1,"achievement_physics-01",null],["ap-022","prep:achievement/physics/waves-sound",1,null,"mcq",null,false,1,"achievement_physics-01",null],["ap-023","prep:achievement/physics/waves-sound",2,null,"mcq",null,false,1,"achievement_physics-01",null],["ap-024","prep:achievement/physics/waves-sound",2,null,"mcq",null,false,1,"achievement_physics-01",null],["ap-025","prep:achievement/physics/waves-sound",3,null,"mcq",null,false,1,"achievement_physics-01",null],["ap-026","prep:achievement/physics/optics",1,null,"mcq",null,false,1,"achievement_physics-01",null],["ap-027","prep:achievement/physics/optics",1,null,"mcq",null,false,1,"achievement_physics-01",null],["ap-028","prep:achievement/physics/optics",2,null,"mcq",null,false,1,"achievement_physics-01",null],["ap-029","prep:achievement/physics/optics",2,null,"mcq",null,false,1,"achievement_physics-01",null],["ap-030","prep:achievement/physics/optics",3,null,"mcq",null,false,1,"achievement_physics-01",null],["ap-031","prep:achievement/physics/thermodynamics",1,null,"mcq",null,false,1,"achievement_physics-01",null],["ap-032","prep:achievement/physics/thermodynamics",1,null,"mcq",null,false,1,"achievement_physics-01",null],["ap-034","prep:achievement/physics/thermodynamics",2,null,"mcq",null,false,1,"achievement_physics-01",null],["ap-035","prep:achievement/physics/thermodynamics",3,null,"mcq",null,false,1,"achievement_physics-01",null],["ap-036","prep:achievement/physics/modern-physics",1,null,"mcq",null,false,1,"achievement_physics-01",null],["ap-037","prep:achievement/physics/modern-physics",2,null,"mcq",null,false,1,"achievement_physics-01",null],["ap-038","prep:achievement/physics/modern-physics",2,null,"mcq",null,false,1,"achievement_physics-01",null],["ap-039","prep:achievement/physics/modern-physics",2,null,"mcq",null,false,1,"achievement_physics-01",null],["ap-040","prep:achievement/physics/modern-physics",3,null,"mcq",null,false,1,"achievement_physics-01",null]]}
