{"schema":"runtime-bank-sel@1","file_id":"s-middle_grade-1_math","scope":"middle/grade-1/math","columns":["key","lesson","band","component","type","stimulus","premium","revision","chunk","objective"],"rows":[["q-m1-math-0012a3fa00","middle/grade-1/math/n55",3,null,"short_answer",null,false,1,"middle_grade-1_math-01",null],["q-m1-math-25f682044b","middle/grade-1/math/n61",3,null,"mcq",null,true,1,"middle_grade-1_math-01",null],["q-m1-math-2c3a4249d7","middle/grade-1/math/n53",2,null,"mcq",null,false,1,"middle_grade-1_math-01",null],["q-m1-math-2f5da6e992","middle/grade-1/math/n54",3,null,"mcq",null,false,1,"middle_grade-1_math-01",null],["q-m1-math-3c56619749","middle/grade-1/math/n54",3,null,"mcq",null,true,1,"middle_grade-1_math-01",null],["q-m1-math-43700797e2","middle/grade-1/math/n62",3,null,"mcq",null,false,1,"middle_grade-1_math-01",null],["q-m1-math-449777124b","middle/grade-1/math/n62",3,null,"true_false",null,false,1,"middle_grade-1_math-01",null],["q-m1-math-4539e4b488","middle/grade-1/math/n53",1,null,"true_false",null,false,1,"middle_grade-1_math-01",null],["q-m1-math-4814d92093","middle/grade-1/math/n54",1,"xg-aa00000001","mcq",null,false,1,"middle_grade-1_math-01","obj-fa3d3bfb40"],["q-m1-math-486bacc5c2","middle/grade-1/math/n54",2,null,"numeric",null,false,1,"middle_grade-1_math-01",null],["q-m1-math-66220e7159","middle/grade-1/math/n53",3,null,"ordering",null,false,1,"middle_grade-1_math-01",null],["q-m1-math-730bea4ff1","middle/grade-1/math/n53",1,null,"short_answer",null,false,1,"middle_grade-1_math-01",null],["q-m1-math-76a8277347","middle/grade-1/math/n54",2,null,"matching",null,false,1,"middle_grade-1_math-01",null],["q-m1-math-79b98f273c","middle/grade-1/math/n61",1,null,"short_answer",null,false,1,"middle_grade-1_math-01",null],["q-m1-math-7c1c97df17","middle/grade-1/math/n55",2,null,"mcq","st-149a822f4d",false,1,"middle_grade-1_math-01",null],["q-m1-math-7dc96f776c","middle/grade-1/math/n54",1,"xg-aa00000001","mcq",null,false,1,"middle_grade-1_math-01","obj-fa3d3bfb40"],["q-m1-math-82f3e9c695","middle/grade-1/math/n62",1,null,"mcq",null,false,2,"middle_grade-1_math-01",null],["q-m1-math-844ecc0816","middle/grade-1/math/x5a3afdd4",2,null,"mcq",null,false,1,"middle_grade-1_math-01",null],["q-m1-math-8b53639f15","middle/grade-1/math/n61",1,null,"mcq",null,false,1,"middle_grade-1_math-01",null],["q-m1-math-8b5cc4df7e","middle/grade-1/math/n62",1,null,"mcq",null,false,1,"middle_grade-1_math-01",null],["q-m1-math-9c0abe51c6","middle/grade-1/math/n55",2,null,"mcq","st-149a822f4d",false,1,"middle_grade-1_math-01",null],["q-m1-math-ac0f09c0f8","middle/grade-1/math/n62",2,null,"mcq",null,false,1,"middle_grade-1_math-01",null],["q-m1-math-af327a6478","middle/grade-1/math/n61",3,null,"matching",null,false,1,"middle_grade-1_math-01",null],["q-m1-math-cef7fc13a3","middle/grade-1/math/n62",2,null,"numeric",null,false,1,"middle_grade-1_math-01",null],["q-m1-math-d0bf3e6ee1","middle/grade-1/math/n55",3,null,"numeric",null,false,1,"middle_grade-1_math-01",null],["q-m1-math-d0f631ca1d","middle/grade-1/math/n55",1,null,"mcq",null,false,1,"middle_grade-1_math-01",null],["q-m1-math-e788103ee1","middle/grade-1/math/n61",2,null,"true_false",null,false,1,"middle_grade-1_math-01",null],["q-m1-math-ec31682fde","middle/grade-1/math/xb321f898",1,null,"mcq",null,false,1,"middle_grade-1_math-01",null],["q-m1-math-f451a61749","middle/grade-1/math/n61",2,null,"ordering",null,false,1,"middle_grade-1_math-01",null],["q-m1-math-f46dd28a54","middle/grade-1/math/n53",2,null,"mcq",null,false,1,"middle_grade-1_math-01",null],["q-m1-math-f55ff16f66","middle/grade-1/math/n53",1,null,"mcq",null,false,1,"middle_grade-1_math-01",null]]}
