{"schema":"runtime-bank-sel@1","file_id":"s-aptitude_quantitative","scope":"prep:aptitude/quantitative","columns":["key","lesson","band","component","type","stimulus","premium","revision","chunk","objective"],"rows":[["aq-001","prep:aptitude/quantitative/arithmetic",1,null,"mcq",null,false,1,"aptitude_quantitative-01",null],["aq-002","prep:aptitude/quantitative/arithmetic",1,null,"mcq",null,false,1,"aptitude_quantitative-01",null],["aq-004","prep:aptitude/quantitative/arithmetic",1,null,"mcq",null,false,1,"aptitude_quantitative-01",null],["aq-005","prep:aptitude/quantitative/arithmetic",2,null,"mcq",null,false,1,"aptitude_quantitative-01",null],["aq-006","prep:aptitude/quantitative/arithmetic",2,null,"mcq",null,false,1,"aptitude_quantitative-01",null],["aq-008","prep:aptitude/quantitative/arithmetic",3,null,"mcq",null,false,1,"aptitude_quantitative-01",null],["aq-009","prep:aptitude/quantitative/arithmetic",3,null,"mcq",null,false,1,"aptitude_quantitative-01",null],["aq-010","prep:aptitude/quantitative/arithmetic",3,null,"mcq",null,false,1,"aptitude_quantitative-01",null],["aq-011","prep:aptitude/quantitative/fractions-percent",1,null,"mcq",null,false,1,"aptitude_quantitative-01",null],["aq-012","prep:aptitude/quantitative/fractions-percent",1,null,"mcq",null,false,1,"aptitude_quantitative-01",null],["aq-013","prep:aptitude/quantitative/fractions-percent",1,null,"mcq",null,false,1,"aptitude_quantitative-01",null],["aq-014","prep:aptitude/quantitative/fractions-percent",1,null,"mcq",null,false,1,"aptitude_quantitative-01",null],["aq-015","prep:aptitude/quantitative/fractions-percent",2,null,"mcq",null,false,1,"aptitude_quantitative-01",null],["aq-016","prep:aptitude/quantitative/fractions-percent",2,null,"mcq",null,false,1,"aptitude_quantitative-01",null],["aq-017","prep:aptitude/quantitative/fractions-percent",2,null,"mcq",null,false,1,"aptitude_quantitative-01",null],["aq-018","prep:aptitude/quantitative/fractions-percent",2,null,"mcq",null,false,1,"aptitude_quantitative-01",null],["aq-019","prep:aptitude/quantitative/fractions-percent",2,null,"mcq",null,false,1,"aptitude_quantitative-01",null],["aq-020","prep:aptitude/quantitative/fractions-percent",3,null,"mcq",null,false,1,"aptitude_quantitative-01",null],["aq-021","prep:aptitude/quantitative/fractions-percent",3,null,"mcq",null,false,1,"aptitude_quantitative-01",null],["aq-022","prep:aptitude/quantitative/ratio-proportion",1,null,"mcq",null,false,1,"aptitude_quantitative-01",null],["aq-023","prep:aptitude/quantitative/ratio-proportion",1,null,"mcq",null,false,1,"aptitude_quantitative-01",null],["aq-024","prep:aptitude/quantitative/ratio-proportion",1,null,"mcq",null,false,1,"aptitude_quantitative-01",null],["aq-025","prep:aptitude/quantitative/ratio-proportion",2,null,"mcq",null,false,1,"aptitude_quantitative-01",null],["aq-026","prep:aptitude/quantitative/ratio-proportion",2,null,"mcq",null,false,1,"aptitude_quantitative-01",null],["aq-027","prep:aptitude/quantitative/ratio-proportion",2,null,"mcq",null,false,1,"aptitude_quantitative-01",null],["aq-028","prep:aptitude/quantitative/ratio-proportion",2,null,"mcq",null,false,1,"aptitude_quantitative-01",null],["aq-029","prep:aptitude/quantitative/ratio-proportion",2,null,"mcq",null,false,1,"aptitude_quantitative-01",null],["aq-030","prep:aptitude/quantitative/ratio-proportion",3,null,"mcq",null,false,1,"aptitude_quantitative-01",null],["aq-031","prep:aptitude/quantitative/ratio-proportion",3,null,"mcq",null,false,1,"aptitude_quantitative-01",null],["aq-032","prep:aptitude/quantitative/algebra",1,null,"mcq",null,false,1,"aptitude_quantitative-01",null],["aq-033","prep:aptitude/quantitative/algebra",1,null,"mcq",null,false,1,"aptitude_quantitative-01",null],["aq-034","prep:aptitude/quantitative/algebra",1,null,"mcq",null,false,1,"aptitude_quantitative-01",null],["aq-035","prep:aptitude/quantitative/algebra",1,null,"mcq",null,false,1,"aptitude_quantitative-01",null],["aq-036","prep:aptitude/quantitative/algebra",2,null,"mcq",null,false,1,"aptitude_quantitative-01",null],["aq-037","prep:aptitude/quantitative/algebra",2,null,"mcq",null,false,1,"aptitude_quantitative-01",null],["aq-038","prep:aptitude/quantitative/algebra",2,null,"mcq",null,false,1,"aptitude_quantitative-01",null],["aq-039","prep:aptitude/quantitative/algebra",2,null,"mcq",null,false,1,"aptitude_quantitative-01",null],["aq-040","prep:aptitude/quantitative/algebra",2,null,"mcq",null,false,1,"aptitude_quantitative-01",null],["aq-041","prep:aptitude/quantitative/algebra",3,null,"mcq",null,false,1,"aptitude_quantitative-01",null],["aq-042","prep:aptitude/quantitative/algebra",2,null,"mcq",null,false,1,"aptitude_quantitative-01",null],["aq-043","prep:aptitude/quantitative/geometry",1,null,"mcq",null,false,1,"aptitude_quantitative-01",null],["aq-044","prep:aptitude/quantitative/geometry",1,null,"mcq",null,false,1,"aptitude_quantitative-01",null],["aq-045","prep:aptitude/quantitative/geometry",1,null,"mcq",null,false,1,"aptitude_quantitative-01",null],["aq-046","prep:aptitude/quantitative/geometry",1,null,"mcq",null,false,1,"aptitude_quantitative-01",null],["aq-047","prep:aptitude/quantitative/geometry",2,null,"mcq",null,false,1,"aptitude_quantitative-01",null],["aq-048","prep:aptitude/quantitative/geometry",2,null,"mcq",null,false,1,"aptitude_quantitative-01",null],["aq-049","prep:aptitude/quantitative/geometry",2,null,"mcq",null,false,1,"aptitude_quantitative-01",null],["aq-050","prep:aptitude/quantitative/geometry",2,null,"mcq",null,false,1,"aptitude_quantitative-01",null],["aq-051","prep:aptitude/quantitative/geometry",2,null,"mcq",null,false,1,"aptitude_quantitative-01",null],["aq-052","prep:aptitude/quantitative/geometry",3,null,"mcq",null,false,1,"aptitude_quantitative-01",null],["aq-053","prep:aptitude/quantitative/geometry",3,null,"mcq",null,false,1,"aptitude_quantitative-01",null],["aq-054","prep:aptitude/quantitative/statistics",1,null,"mcq",null,false,1,"aptitude_quantitative-01",null],["aq-055","prep:aptitude/quantitative/statistics",1,null,"mcq",null,false,1,"aptitude_quantitative-01",null],["aq-056","prep:aptitude/quantitative/statistics",2,null,"mcq",null,false,1,"aptitude_quantitative-01",null],["aq-057","prep:aptitude/quantitative/statistics",2,null,"mcq",null,false,1,"aptitude_quantitative-01",null],["aq-058","prep:aptitude/quantitative/statistics",2,null,"mcq",null,false,1,"aptitude_quantitative-01",null],["aq-059","prep:aptitude/quantitative/statistics",2,null,"mcq",null,false,1,"aptitude_quantitative-01",null],["aq-060","prep:aptitude/quantitative/statistics",2,null,"mcq",null,false,1,"aptitude_quantitative-01",null],["aq-061","prep:aptitude/quantitative/statistics",3,null,"mcq",null,false,1,"aptitude_quantitative-01",null],["aq-062","prep:aptitude/quantitative/data-interpretation",1,null,"mcq",null,false,1,"aptitude_quantitative-01",null],["aq-063","prep:aptitude/quantitative/data-interpretation",1,null,"mcq",null,false,1,"aptitude_quantitative-01",null],["aq-064","prep:aptitude/quantitative/data-interpretation",1,null,"mcq",null,false,1,"aptitude_quantitative-01",null],["aq-065","prep:aptitude/quantitative/data-interpretation",2,null,"mcq",null,false,1,"aptitude_quantitative-01",null],["aq-066","prep:aptitude/quantitative/data-interpretation",2,null,"mcq",null,false,1,"aptitude_quantitative-01",null],["aq-067","prep:aptitude/quantitative/data-interpretation",2,null,"mcq",null,false,1,"aptitude_quantitative-01",null],["aq-068","prep:aptitude/quantitative/data-interpretation",3,null,"mcq",null,false,1,"aptitude_quantitative-01",null],["aq-069","prep:aptitude/quantitative/data-interpretation",3,null,"mcq",null,false,1,"aptitude_quantitative-01",null],["aq-070","prep:aptitude/quantitative/comparison",1,null,"mcq",null,false,1,"aptitude_quantitative-01",null],["aq-071","prep:aptitude/quantitative/comparison",1,null,"mcq",null,false,1,"aptitude_quantitative-01",null],["aq-072","prep:aptitude/quantitative/comparison",2,null,"mcq",null,false,1,"aptitude_quantitative-01",null],["aq-073","prep:aptitude/quantitative/comparison",1,null,"mcq",null,false,1,"aptitude_quantitative-01",null],["aq-074","prep:aptitude/quantitative/comparison",1,null,"mcq",null,false,1,"aptitude_quantitative-01",null],["aq-075","prep:aptitude/quantitative/comparison",2,null,"mcq",null,false,1,"aptitude_quantitative-01",null],["aq-076","prep:aptitude/quantitative/comparison",2,null,"mcq",null,false,1,"aptitude_quantitative-01",null],["aq-077","prep:aptitude/quantitative/comparison",2,null,"mcq",null,false,1,"aptitude_quantitative-01",null],["aq-078","prep:aptitude/quantitative/comparison",2,null,"mcq",null,false,1,"aptitude_quantitative-01",null],["aq-079","prep:aptitude/quantitative/comparison",3,null,"mcq",null,false,1,"aptitude_quantitative-01",null],["aq-080","prep:aptitude/quantitative/comparison",3,null,"mcq",null,false,1,"aptitude_quantitative-01",null]]}
