{"schema":"runtime-bank-sel@1","file_id":"s-aptitude_verbal","scope":"prep:aptitude/verbal","columns":["key","lesson","band","component","type","stimulus","premium","revision","chunk","objective"],"rows":[["av-101","prep:aptitude/verbal/analogy",1,null,"mcq",null,false,1,"aptitude_verbal-01",null],["av-102","prep:aptitude/verbal/analogy",2,null,"mcq",null,false,1,"aptitude_verbal-01",null],["av-103","prep:aptitude/verbal/analogy",2,null,"mcq",null,false,1,"aptitude_verbal-01",null],["av-104","prep:aptitude/verbal/analogy",3,null,"mcq",null,false,1,"aptitude_verbal-01",null],["av-105","prep:aptitude/verbal/contextual-error",1,null,"mcq",null,false,1,"aptitude_verbal-01",null],["av-106","prep:aptitude/verbal/contextual-error",2,null,"mcq",null,false,1,"aptitude_verbal-01",null],["av-107","prep:aptitude/verbal/contextual-error",3,null,"mcq",null,false,1,"aptitude_verbal-01",null],["av-108","prep:aptitude/verbal/odd-word-out",1,null,"mcq",null,false,1,"aptitude_verbal-01",null],["av-109","prep:aptitude/verbal/odd-word-out",2,null,"mcq",null,false,1,"aptitude_verbal-01",null]]}
